Symbol,Name,Last Sale,Net Change,% Change,Market Cap,Country,IPO Year,Volume,Sector,Industry
CRU,Crucible Acquisition Corporation Class A Common Stock,$9.72,0.00,0.00%,314381250.00,,2021,166941,Finance,Finance: Consumer Services
CRY,CryoLife Inc. Common Stock,$24.98,-0.52,-2.039%,981871674.00,United States,,27699,Health Care,Medical/Dental Instruments
CS,Credit Suisse Group American Depositary Shares,$10.3809,-0.0491,-0.471%,25031135967.00,Switzerland,,991111,Finance,Investment Bankers/Brokers/Service
CSAN,Cosan S.A. ADS,$18.16,-0.09,-0.493%,8475665745.00,,2021,83131,Consumer Durables,Automotive Aftermarket
CSL,Carlisle Companies Incorporated Common Stock,$207.33,-0.24,-0.116%,10807199819.00,United States,,40305,Finance,Finance: Consumer Services
CSLT,Castlight Health Inc. Class B Common Stock,$1.871,-0.049,-2.552%,299831245.00,,2014,384464,Technology,EDP Services
CSPR,Casper Sleep Inc. Common Stock,$5.56,-0.06,-1.068%,230408313.00,,2020,439651,Consumer Durables,Home Furnishings
CSR,D/B/A Centerspace Common Stock,$95.25,0.79,0.836%,1337772915.00,United States,,15729,Consumer Services,Real Estate Investment Trusts
CSR^C,D/B/A Centerspace 6.625% Series C ,$26.1601,-0.237,-0.898%,,United States,,261,,
CSTA,Constellation Acquisition Corp I Class A Ordinary Shares,$9.67,0.01,0.104%,383173750.00,,2021,200,Finance,Business Services
CSTM,Constellium SE Ordinary Shares (France),$20.19,0.25,1.254%,2860466020.00,Netherlands,2013,699386,Basic Industries,Metal Fabrications
CSU,Capital Senior Living Corporation Common Stock,$28.97,4.01,16.066%,63461653.00,United States,1997,28831,Health Care,Hospital/Nursing Management
CSV,Carriage Services Inc. Common Stock,$39.41,-0.07,-0.177%,702511783.00,United States,,48522,Consumer Services,Other Consumer Services
CTA^A,E.I. du Pont de Nemours and Company Preferred Stock,$93.52,0.5601,0.603%,,United States,,737,,
CTA^B,E.I. du Pont de Nemours and Company Preferred Stock,$114.80,0.00,0.00%,,United States,,241,,
CTAC,Cerberus Telecom Acquisition Corp. Class A Ordinary Shares,$9.94,0.00,0.00%,330151762.00,United States,2020,1648,Finance,Business Services
CTBB,Qwest Corporation 6.5% Notes due 2056,$25.41,0.01,0.039%,0.00,United States,2016,27508,,
CTDD,Qwest Corporation 6.75% Notes due 2057,$26.33,-0.01,-0.038%,0.00,United States,2017,16214,,
CTK,CooTek (Cayman) Inc. American Depositary Shares each representing 50 Class A Ordinary Shares,$1.75,-0.02,-1.13%,113052944.00,,2018,69840,Technology,EDP Services
CTLT,Catalent Inc. Common Stock,$120.02,-0.27,-0.224%,20444393191.00,United States,2014,82037,Health Care,Major Pharmaceuticals
CTO,CTO Realty Growth Inc. Common Stock,$55.01,0.16,0.292%,327669265.00,United States,,5918,Consumer Services,Real Estate
CTO^A,CTO Realty Growth Inc. 6.375% Series A Cumulative Redeemable Preferred Stock,$25.5999,0.0299,0.117%,,United States,,1645,,
CTOS,Custom Truck One Source Inc. Common Stock,$7.165,-0.625,-8.023%,1766875086.00,Cayman Islands,2017,306479,Technology,Diversified Commercial Services
CTR,ClearBridge MLP and Midstream Total Return Fund Inc. Common Stock,$23.65,-0.14,-0.588%,168331216.00,United States,2012,10064,Finance,Investment Managers
CTS,CTS Corporation Common Stock,$35.62,-0.45,-1.248%,1155034566.00,United States,,33367,Capital Goods,Industrial Machinery/Components
CTT,CatchMark Timber Trust Inc. Class A Common Stock,$11.60,0.01,0.086%,567230418.00,United States,2013,86365,Consumer Services,Real Estate Investment Trusts
CTVA,Corteva Inc. Common Stock ,$46.11,0.05,0.109%,33853270350.00,,2019,1477770,Consumer Non-Durables,Farming/Seeds/Milling
CUBB,Customers Bancorp Inc 5.375% Subordinated Notes Due 2034,$27.40,-0.02,-0.073%,0.00,United States,2019,100,Finance,Major Banks
CUBE,CubeSmart Common Shares,$50.385,-0.085,-0.168%,10166186841.00,United States,,180403,Consumer Services,Real Estate Investment Trusts
CUBI,Customers Bancorp Inc Common Stock,$38.96,-0.53,-1.342%,1261289287.00,United States,,42537,Finance,Major Banks
CUBI^C,Customers Bancorp Inc Fixed-to-Floating Rate Non-Cumulative Perpetual Preferred Stock Series C,$25.28,-0.16,-0.629%,,United States,,5642,,
CUBI^D,Customers Bancorp Inc Fixed-to-Floating Rate Non-Cumulative Perpetual Preferred Stock Series D,$25.27,-0.06,-0.237%,,United States,,500,,
CUBI^E,Customers Bancorp Inc Fixed-to-Floating Rate Non-Cumulative Perpetual Preferred Stock Series E,$25.44,0.14,0.553%,,United States,,4860,,
CUBI^F,Customers Bancorp Inc Fixed-to-Floating Rate Non-Cumulative Perpetual Preferred Stock Series F,$25.43,0.0088,0.035%,,United States,,350,,
CUK,Carnival Plc ADS ADS,$21.44,-0.02,-0.093%,24841187271.00,United States,,555710,Transportation,Transportation Services
CULP,Culp Inc. Common Stock,$14.51,0.32,2.255%,178802203.00,United States,,18046,Basic Industries,Textiles
CURO,CURO Group Holdings Corp. Common Stock,$16.545,0.085,0.516%,685453410.00,,2017,34486,Finance,Finance: Consumer Services
CURV,Torrid Holdings Inc. Common Stock,$30.04,0.01,0.033%,3353966000.00,,2021,74836,,
CUZ,Cousins Properties Incorporated Common Stock,$39.22,-0.08,-0.204%,5831544772.00,United States,,301761,Consumer Services,Real Estate Investment Trusts
CVA,Covanta Holding Corporation Common Stock,$19.97,-0.01,-0.05%,2656193365.00,United States,,452484,Public Utilities,Combination Utilities
CVE,Cenovus Energy Inc Common Stock,$8.295,-0.135,-1.601%,16736091540.00,Canada,,2825870,Basic Industries,Petroleum Products
CVEO,Civeo Corporation (Canada) Common Shares,$22.49,0.20,0.897%,321973002.00,,2014,3632,Consumer Services,Business Services
CVI,CVR Energy Inc. Common Stock,$13.54,0.21,1.575%,1361184310.00,United States,2007,264117,Energy,Integrated oil Companies
CVII,Churchill Capital Corp VII Class A Common Stock,$9.68,-0.02,-0.206%,1669800000.00,,2021,7758,Finance,Finance: Consumer Services
CVNA,Carvana Co. Class A Common Stock,$360.34,2.19,0.611%,62188592092.00,United States,2017,261010,Consumer Services,Other Specialty Stores
CVS,CVS Health Corporation Common Stock,$84.495,-0.645,-0.758%,111497467994.00,United States,,1470973,Health Care,Managed Health Care
CVX,Chevron Corporation Common Stock,$102.40,-0.24,-0.234%,198032583066.00,United States,,3301718,Energy,Integrated oil Companies
CW,Curtiss-Wright Corporation Common Stock,$120.90,-0.09,-0.074%,4942875479.00,United States,,30321,Capital Goods,Industrial Machinery/Components
CWEN,Clearway Energy Inc. Class C Common Stock,$31.14,0.34,1.104%,3623460116.00,United States,2015,130308,Public Utilities,Electric Utilities: Central
CWH,Camping World Holdings Inc. Class A Commom Stock,$39.79,-0.41,-1.02%,3484390126.00,United States,2016,317697,Capital Goods,Recreational Products/Toys
CWK,Cushman & Wakefield plc Ordinary Shares,$18.215,0.105,0.58%,4066468968.00,,2018,811639,Finance,Real Estate
CWT,California Water Service Group Common Stock,$63.815,0.165,0.259%,3288706025.00,United States,,34618,Public Utilities,Water Supply
CX,Cemex S.A.B. de C.V. Sponsored ADR,$8.13,0.14,1.752%,11974653195.00,Mexico,,3300024,Capital Goods,Building Materials
CXE,MFS High Income Municipal Trust Common Stock,$5.39,0.04,0.748%,169912571.00,United States,1989,34531,Finance,Investment Managers
CXH,MFS Investment Grade Municipal Trust Common Stock,$10.56,0.00,0.00%,96204187.00,United States,1989,800,Finance,Investment Managers
CXM,Sprinklr Inc. Class A Common Stock,$19.01,0.16,0.849%,4716174285.00,,2021,85740,,
CXP,Columbia Property Trust Inc. Common Stock,$16.35,0.04,0.245%,1878680138.00,United States,2013,212617,Consumer Services,Real Estate Investment Trusts
CXW,CoreCivic Inc. Common Stock,$10.65,-0.19,-1.753%,1281032747.00,United States,,180669,Consumer Services,Real Estate Investment Trusts
CYD,China Yuchai International Limited Common Stock,$14.82,-0.30,-1.984%,605519858.00,Singapore,1994,11087,Capital Goods,Construction/Ag Equipment/Trucks
CYH,Community Health Systems Inc. Common Stock,$12.06,-0.49,-3.904%,1592861958.00,United States,2000,454713,Health Care,Hospital/Nursing Management
D,Dominion Energy Inc. Common Stock,$77.57,0.21,0.271%,62714361723.00,United States,,721712,Public Utilities,Electric Utilities: Central
DAC,Danaos Corporation Common Stock,$72.2199,-0.3101,-0.428%,1487653387.00,Greece,2006,107286,Transportation,Marine Transportation
DAL,Delta Air Lines Inc. Common Stock,$40.28,-0.25,-0.617%,25775771286.00,United States,,3862647,Transportation,Air Freight/Delivery Services
DAN,Dana Incorporated Common Stock ,$24.12,-0.14,-0.577%,3502919066.00,United States,,105311,Capital Goods,Auto Parts:O.E.M.
DAO,Youdao Inc. American Depositary Shares each representing one Class A Ordinary Share,$9.085,-0.475,-4.969%,1126366985.00,,2019,171572,Consumer Services,Other Consumer Services
DAR,Darling Ingredients Inc. Common Stock,$78.00,0.67,0.866%,12641444088.00,United States,,648142,Consumer Non-Durables,Farming/Seeds/Milling
DASH,DoorDash Inc. Class A Common Stock,$190.21,2.00,1.063%,61977618209.00,,2020,4005293,Capital Goods,Industrial Machinery/Components
DAVA,Endava plc American Depositary Shares (each representing one Class A Ordinary Share),$139.02,3.02,2.221%,7662413302.00,,2018,57178,Technology,EDP Services
DB,Deutsche Bank AG Common Stock,$12.935,0.085,0.661%,26694390274.00,Germany,,1580223,Finance,Commercial Banks
DBD,Diebold Nixdorf Incorporated Common Stock,$11.47,-0.10,-0.864%,898718166.00,United States,,143932,Technology,EDP Services
DBI,Designer Brands Inc. Class A Common Stock,$14.77,-0.28,-1.86%,1076262147.00,United States,,227105,Consumer Services,Clothing/Shoe/Accessory Stores
DBL,DoubleLine Opportunistic Credit Fund Common Shares of Beneficial Interest,$19.885,-0.115,-0.575%,297718498.00,United States,2012,10924,Finance,Pension Health And Welfare Funds
DBRG,DigitalBridge Group Inc.,$7.07,-0.08,-1.119%,3486231981.00,United States,2014,431940,Consumer Services,Real Estate Investment Trusts
DBRG^G,DigitalBridge Group Inc. 7.50% Series G ,$25.14,0.00,0.00%,,United States,,1464,,
DBRG^H,DigitalBridge Group Inc. 7.125% Series H ,$25.335,0.075,0.297%,,United States,,1523,,
DBRG^I,DigitalBridge Group Inc. 7.15% Series I ,$25.6901,-0.1099,-0.426%,,United States,,2224,,
DBRG^J,DigitalBridge Group Inc. 7.125% Series J ,$25.87,0.12,0.466%,,United States,,1418,,
DCF,BNY Mellon Alcentra Global Credit Income 2024 Target Term Fund Inc. Common Stock,$9.6598,0.0698,0.728%,144540862.00,,2017,5503,Finance,Finance/Investors Services
DCI,Donaldson Company Inc. Common Stock,$68.06,-0.25,-0.366%,8547295771.00,United States,,58092,Capital Goods,Pollution Control Equipment
DCO,Ducommun Incorporated Common Stock,$53.265,-2.125,-3.836%,631168784.00,United States,,12745,Capital Goods,Military/Government/Technical
DCP,DCP Midstream  LP Common Units ,$27.19,-0.25,-0.911%,5665378333.00,United States,,166334,Public Utilities,Natural Gas Distribution
DCP^B,DCP Midstream LP 7.875% Series B Fixed-to-Floating Rate Cumulative Redeemable Perpetual Preferred Units,$25.705,-0.045,-0.175%,,United States,,947,,
DCP^C,DCP Midstream LP 7.95% Series C Fixed-to-Floating Rate Cumulative Redeemable Perpetual Preferred Units,$25.062,0.042,0.168%,,United States,,4646,,
DCUE,Dominion Energy Inc. 2019 Series A Corporate Units,$101.82,0.01,0.01%,0.00,United States,2019,7138,Public Utilities,Electric Utilities: Central
DD,DuPont de Nemours Inc. Common Stock,$77.12,-0.88,-1.128%,40338132087.00,,2017,692262,Basic Industries,Major Chemicals
DDD,3D Systems Corporation Common Stock,$30.64,-2.63,-7.905%,3837216700.00,United States,,2241307,Technology,Computer peripheral equipment
DDF,Delaware Investments Dividend & Income Fund Inc. Common Stock,$11.11,0.09,0.817%,84559965.00,United States,1993,8606,Finance,Finance/Investors Services
DDL,Dingdong (Cayman) Limited American Depositary Shares (each two representing three Ordinary Shares),$18.63,-2.80,-13.066%,4397636334.00,,2021,223675,,
DDS,Dillard's Inc. Common Stock,$202.05,10.57,5.52%,4271825759.00,United States,,336483,Consumer Services,Department/Specialty Retail Stores
DDT,Dillard's Capital Trust I,$26.50,0.1472,0.559%,0.00,United States,,3623,Consumer Services,Department/Specialty Retail Stores
DE,Deere & Company Common Stock,$385.28,-0.34,-0.088%,120185049206.00,United States,,380372,Capital Goods,Industrial Machinery/Components
DEA,Easterly Government Properties Inc. Common Stock,$21.905,0.265,1.225%,1838821577.00,United States,2015,420539,Consumer Services,Real Estate Investment Trusts
DECK,Deckers Outdoor Corporation Common Stock,$433.70,3.53,0.821%,11997350722.00,United States,1993,166571,Consumer Non-Durables,Shoe Manufacturing
DEH,D8 Holdings Corp. Class A Ordinary Shares,$9.9589,0.0089,0.089%,429477563.00,Hong Kong,2020,776962,Finance,Business Services
DEI,Douglas Emmett Inc. Common Stock,$32.09,0.25,0.785%,5630911626.00,United States,2006,169349,Consumer Services,Real Estate Investment Trusts
DELL,Dell Technologies Inc. Class C Common Stock ,$100.23,-0.28,-0.279%,76544664637.00,,2018,337178,Technology,Computer Manufacturing
DEN,Denbury Inc. Common Stock,$69.60,0.06,0.086%,3487652520.00,,2020,189739,Energy,Oil & Gas Production
DEO,Diageo plc Common Stock,$201.3056,2.2456,1.128%,117546861164.00,United Kingdom,,161292,Consumer Non-Durables,Beverages (Production/Distribution)
DESP,Despegar.com Corp. Ordinary Shares,$12.60,-0.65,-4.906%,883251533.00,,2017,270315,Transportation,Other Consumer Services
DEX,Delaware Enhanced Global Dividend Common Shares of Beneficial Interest,$10.54,0.02,0.19%,119145551.00,United States,2007,12245,Finance,Finance Companies
DFIN,Donnelley Financial Solutions Inc. Common Stock ,$32.40,-0.45,-1.37%,1088861389.00,,2016,28405,Finance,Investment Managers
DFNS,LGL Systems Acquisition Corp. Common Stock,$10.00,-0.01,-0.10%,215625000.00,United States,2020,8028,Finance,Finance: Consumer Services
DFP,Flaherty & Crumrine Dynamic Preferred and Income Fund Inc. Common Stock,$30.076,0.016,0.053%,582657416.00,,2013,7400,Finance,Investment Managers
DFS,Discover Financial Services Common Stock,$135.275,1.015,0.756%,40510593221.00,United States,,514331,Finance,Finance: Consumer Services
DG,Dollar General Corporation Common Stock,$237.0286,0.7486,0.317%,55987456607.00,United States,2009,631440,Consumer Services,Department/Specialty Retail Stores
DGX,Quest Diagnostics Incorporated Common Stock,$148.63,0.56,0.378%,18159726210.00,United States,,305980,Health Care,Medical Specialities
DHF,BNY Mellon High Yield Strategies Fund Common Stock,$3.36,0.00,0.00%,244297832.00,United States,1998,44424,Finance,Finance Companies
DHI,D.R. Horton Inc. Common Stock,$97.38,0.00,0.00%,34880974178.00,United States,,521836,Capital Goods,Homebuilding
DHR,Danaher Corporation Common Stock,$313.91,0.14,0.045%,224100212449.00,United States,,633468,Capital Goods,Industrial Machinery/Components
DHR^A,Danaher Corporation 4.75% Mandatory Convertible Preferred Stock Series A,$2109.70,2.65,0.126%,,United States,,2157,,
DHR^B,Danaher Corporation 5.00% Mandatory Convertible Preferred Stock Series B,$1673.89,0.00,0.00%,,United States,,3211,,
DHT,DHT Holdings Inc.,$5.465,-0.095,-1.709%,917672870.00,Jersey,2005,1270734,Transportation,Marine Transportation
DHX,DHI Group Inc. Common Stock,$3.88,0.10,2.646%,194930288.00,United States,2007,106502,Technology,Diversified Commercial Services
DIAX,Nuveen Dow 30SM Dynamic Overwrite Fund Common Shares of Beneficial Interest,$17.66,-0.05,-0.282%,642239701.00,,2014,31680,Finance,Finance Companies
DIDI,DiDi Global Inc. American Depositary Shares (each four representing one Class A Ordinary Share),$8.3399,-0.4701,-5.336%,40225351586.00,,2021,16841943,,
DIN,Dine Brands Global Inc. Common Stock,$77.32,0.56,0.73%,1328049712.00,United States,,55810,Consumer Services,Restaurants
DIS,Walt Disney Company (The) Common Stock,$182.8298,3.5398,1.974%,332189324778.00,United States,,23698762,Consumer Services,Services-Misc. Amusement & Recreation
DK,Delek US Holdings Inc. Common Stock,$16.78,-0.15,-0.886%,1242763330.00,United States,2017,112362,Energy,Integrated oil Companies
DKL,Delek Logistics Partners L.P. Common Units representing Limited Partner Interests,$40.35,-0.21,-0.518%,1753346022.00,United States,2012,7939,Energy,Oil & Gas Production
DKS,Dick's Sporting Goods Inc Common Stock,$109.545,0.065,0.059%,9779013903.00,United States,2002,702514,Consumer Services,Other Specialty Stores
DLB,Dolby Laboratories Common Stock,$99.33,0.99,1.007%,10070817991.00,United States,2005,185122,Miscellaneous,Multi-Sector Companies
DLNG,Dynagas LNG Partners LP Common Units,$3.06,-0.04,-1.29%,112595169.00,Greece,,18102,Transportation,Other Transportation
DLNG^A,Dynagas LNG Partners LP 9.00% Series A Cumulative Redeemable Preferred Units,$25.06,-0.04,-0.159%,,Greece,,4662,,
DLNG^B,Dynagas LNG Partners LP 8.75% Series B Fixed to Floating Rate Cumulative Redeemable Perpetual Preferred Units liquidation preference $25.00 per Uni,$24.84,-0.4906,-1.937%,,Greece,,9418,,
DLR,Digital Realty Trust Inc. Common Stock,$158.48,0.96,0.609%,44785406469.00,United States,2004,166088,Consumer Services,Real Estate Investment Trusts
DLR^J,Digital Realty Trust Inc. 5.250% Series J Cumulative Redeemable Preferred Stock,$26.30,0.07,0.267%,,United States,,871,,
DLR^K,Digital Realty Trust Inc. 5.850% Series K Cumulative Redeemable Preferred Stock par value $0.01 per share,$28.00,0.02,0.071%,,United States,,3863,,
DLR^L,Digital Realty Trust Inc. 5.200% Series L Cumulative Redeemable Preferred Stock,$27.59,-0.04,-0.145%,,United States,,4908,,
DLX,Deluxe Corporation Common Stock,$42.14,-0.27,-0.637%,1792836608.00,United States,,25454,Technology,Advertising
DLY,DoubleLine Yield Opportunities Fund Common Shares of Beneficial Interest,$19.845,0.045,0.227%,951483984.00,,2020,14895,Finance,Investment Managers
DM,Desktop Metal Inc. Class A Common Stock,$8.373,-0.407,-4.636%,2141618451.00,,2019,3432509,Technology,Industrial Machinery/Components
DMB,BNY Mellon Municipal Bond Infrastructure Fund Inc. Common Stock,$15.15,0.00,0.00%,278645572.00,,2013,23456,Finance,Trusts Except Educational Religious and Charitable
DMO,Western Asset Mortgage Opportunity Fund Inc. Common Stock,$15.90,0.06,0.379%,175331113.00,United States,2010,7414,Finance,Trusts Except Educational Religious and Charitable
DMS,Digital Media Solutions Inc. Class A Ordinary Shares,$7.23,0.02,0.277%,449469066.00,United States,2018,103759,Technology,Advertising
DMYI,dMY Technology Group Inc. III Class A Common Stock,$10.00,-0.01,-0.10%,375000000.00,United States,2021,405720,Finance,Finance: Consumer Services
DMYQ,dMY Technology Group Inc. IV Class A Common Stock,$9.89,0.01,0.101%,426506250.00,,2021,13735,Finance,Finance: Consumer Services
DNB,Dun & Bradstreet Holdings Inc. Common Stock,$19.145,0.085,0.446%,8253110532.00,United States,2020,278022,Technology,EDP Services
DNMR,Danimer Scientific Inc. Common Stock,$15.17,-0.69,-4.351%,1297588933.00,,2020,1195968,Consumer Non-Durables,Plastic Products
DNOW,NOW Inc. Common Stock,$7.5926,-0.1174,-1.523%,839428980.00,,2014,142395,Energy,Metal Fabrications
DNP,DNP Select Income Fund Inc. Common Stock,$10.70,-0.02,-0.187%,3648447512.00,United States,1987,186686,Finance,Investment Managers
DNZ,D and Z Media Acquisition Corp. Class A Common Stock,$9.65,0.001,0.01%,346796875.00,,2021,11004,Finance,Finance: Consumer Services
DOC,Physicians Realty Trust Common Shares of Beneficial Interest,$18.57,0.17,0.924%,4037226969.00,United States,2013,378962,Consumer Services,Real Estate Investment Trusts
DOCN,DigitalOcean Holdings Inc. Common Stock,$52.66,-2.32,-4.22%,5652532036.00,,2021,879186,Technology,Retail: Computer Software & Peripheral Equipment
DOCS,Doximity Inc. Class A Common Stock,$77.53,-2.01,-2.527%,13816429026.00,,2021,3912101,,
DOLE,Dole plc Ordinary Shares,$15.4991,0.2391,1.567%,1442945193.00,,2021,254117,Consumer Non-Durables,Farming/Seeds/Milling
DOMA,Doma Holdings Inc. Common Stock,$8.675,0.365,4.392%,2800181441.00,,2021,316264,Finance,Finance: Consumer Services
DOOR,Masonite International Corporation Ordinary Shares (Canada),$123.20,-0.44,-0.356%,2968056045.00,Canada,,62017,Consumer Durables,Home Furnishings
DOV,Dover Corporation Common Stock,$172.035,-0.025,-0.015%,24766319109.00,United States,,171964,Capital Goods,Industrial Machinery/Components
DOW,Dow Inc. Common Stock ,$63.85,-0.16,-0.25%,47617528664.00,,2019,1239083,Basic Industries,Major Chemicals
DPG,Duff & Phelps Utility and Infrastructure Fund Inc.,$14.6399,-0.0101,-0.069%,555288567.00,United States,2011,30030,Finance,Trusts Except Educational Religious and Charitable
DPZ,Domino's Pizza Inc Common Stock,$516.34,-0.14,-0.027%,19029303308.00,United States,2004,135665,Consumer Services,Restaurants
DQ,DAQO New Energy Corp. American Depositary Shares each representing five ordinary shares,$52.9899,-3.6201,-6.395%,3895477253.00,China,2010,1115426,Technology,Semiconductors
DRD,DRDGOLD Limited American Depositary Shares,$9.43,-0.10,-1.049%,806372304.00,South Africa,,85370,Basic Industries,Precious Metals
DRE,Duke Realty Corporation Common Stock,$50.80,0.03,0.059%,19219692879.00,United States,,291660,Consumer Services,Real Estate Investment Trusts
DRH,Diamondrock Hospitality Company Common Stock,$8.77,0.00,0.00%,1847135997.00,United States,2005,252410,Consumer Services,Real Estate Investment Trusts
DRH^A,Diamondrock Hospitality Company 8.250% Series A Cumulative Redeemable Preferred Stock,$28.91,0.00,0.00%,,United States,,465,,
DRI,Darden Restaurants Inc. Common Stock,$142.91,0.95,0.669%,18687300744.00,United States,,329853,Consumer Services,Restaurants
DRQ,Dril-Quip Inc. Common Stock,$26.67,-0.19,-0.707%,944947704.00,United States,1997,63177,Energy,Metal Fabrications
DRUA,Dominion Energy Inc. 2016 Series A 5.25% Enhanced Junior Subordinated Notes due 2076,$25.07,0.00,0.00%,0.00,United States,2016,27012,Public Utilities,Electric Utilities: Central
DS,Drive Shack Inc.,$2.64,-0.03,-1.124%,243105506.00,United States,,438791,Consumer Services,Movies/Entertainment
DS^B,Drive Shack Inc. Preferred Series B,$25.7601,-0.3799,-1.453%,,United States,,3102,,
DS^C,Drive Shack Inc. Preferred Series C,$25.50,-0.05,-0.196%,,United States,,500,,
DS^D,Drive Shack Inc. Pfd Ser D,$25.58,0.28,1.107%,,United States,,1260,,
DSL,DoubleLine Income Solutions Fund Common Shares of Beneficial Interests,$18.01,0.06,0.334%,1836962872.00,,2013,78364,Finance,Trusts Except Educational Religious and Charitable
DSM,BNY Mellon Strategic Municipal Bond Fund Inc. Common Stock,$8.38,0.04,0.48%,414152262.00,United States,1989,36259,Finance,Investment Managers
DSU,Blackrock Debt Strategies Fund Inc. Common Stock,$11.40,-0.02,-0.175%,531146600.00,United States,1998,88675,Finance,Finance Companies
DSX,Diana Shipping inc. common stock,$4.39,0.01,0.228%,401838659.00,Greece,2005,274789,Transportation,Marine Transportation
DSX^B,Diana Shipping Inc. Perpetual Preferred Shares Series B (Marshall Islands),$25.91,0.00,0.00%,,Greece,,4754,,
DT,Dynatrace Inc. Common Stock,$63.565,0.125,0.197%,18070661647.00,United States,2019,355787,Technology,EDP Services
DTB,DTE Energy Company 2020 Series G 4.375% Junior Subordinated Debentures due 2080,$26.372,-0.068,-0.257%,0.00,United States,2020,3888,Public Utilities,Electric Utilities: Central
DTE,DTE Energy Company Common Stock,$120.38,0.43,0.358%,23323812071.00,United States,,299241,Public Utilities,Electric Utilities: Central
DTF,DTF Tax-Free Income Inc. Common Stock,$14.94,-0.03,-0.20%,105021731.00,United States,1991,3449,Finance,Investment Managers
DTLA^,Brookfield DTLA Inc. 7.625% Series A Cumulative Redeemable Preferred Stock,$14.24,0.05,0.352%,,,,736,,
DTM,DT Midstream Inc. Common Stock ,$42.79,-0.10,-0.233%,4139182220.00,,2021,92595,,
DTP,DTE Energy Company 6.25% Corporate Units,$51.86,0.07,0.135%,0.00,United States,,5328,Public Utilities,Electric Utilities: Central
DTW,DTE Energy Company 2017 Series E 5.25% Junior Subordinated Debentures due 2077,$26.52,0.08,0.303%,0.00,United States,2017,5713,Public Utilities,Electric Utilities: Central
DTY,DTE Energy Company 2016 Series F 6.00% Junior Subordinated Debentures due 2076,$25.8784,0.0784,0.304%,0.00,United States,2016,3060,,
DUK,Duke Energy Corporation (Holding Company) Common Stock,$105.90,0.21,0.199%,81472851628.00,United States,,716133,Public Utilities,Power Generation
DUK^A,Duke Energy Corporation Depositary Shares each representing a 1/1000th interest in a share of 5.75% Series A Cumulative Redeemable Perpetual Preferred Stock,$28.11,-0.09,-0.319%,,United States,,39798,,
DUKB,Duke Energy Corporation 5.625% Junior Subordinated Debentures due 2078,$27.32,0.03,0.11%,0.00,United States,2018,8232,Public Utilities,Power Generation
DUKH,Duke Energy Corporation 5.125% Junior Subordinated Debentures due 2073,$26.5598,0.0398,0.15%,0.00,United States,,8250,Public Utilities,Power Generation
DV,DoubleVerify Holdings Inc. Common Stock,$33.46,-0.34,-1.006%,5281701286.00,,2021,59067,Technology,Computer Software: Prepackaged Software
DVA,DaVita Inc. Common Stock,$131.24,-0.03,-0.023%,13745474683.00,United States,,115815,Health Care,Medical/Nursing Services
DVD,Dover Motorsports Inc. Common Stock,$2.6201,-0.1099,-4.026%,95491093.00,United States,1996,24380,Consumer Services,Services-Misc. Amusement & Recreation
DVN,Devon Energy Corporation Common Stock,$28.32,-0.15,-0.527%,19172640000.00,United States,,2437314,Energy,Oil & Gas Production
DX,Dynex Capital Inc. Common Stock,$17.70,0.10,0.568%,612270170.00,United States,,175013,Consumer Services,Real Estate Investment Trusts
DX^C,Dynex Capital Inc. 6.900% Series C Fixed-to-Floating Rate Cumulative Redeemable Preferred Stock,$26.13,0.00,0.00%,,United States,,1045,,
DXC,DXC Technology Company Common Stock ,$40.9867,-0.5933,-1.427%,10324723596.00,,,303175,Technology,EDP Services
DY,Dycom Industries Inc. Common Stock,$74.78,-0.22,-0.293%,2301630513.00,United States,,120788,Basic Industries,Water Supply
DYFN,Angel Oak Dynamic Financial Strategies Income Term Trust Common Shares of Beneficial Interest,$20.66,0.035,0.17%,83776300.00,,2020,11675,Finance,Finance/Investors Services
E,ENI S.p.A. Common Stock,$24.74,0.04,0.162%,44192439171.00,Italy,,42144,Energy,Oil & Gas Production
