Symbol,Name,Last Sale,Net Change,% Change,Market Cap,Country,IPO Year,Volume,Sector,Industry
RAD,Rite Aid Corporation Common Stock,$15.25,-0.09,-0.587%,840073883.00,United States,,333861,Health Care,Medical/Nursing Services
RAMP,LiveRamp Holdings Inc. Common Stock,$46.16,-0.86,-1.829%,3135288013.00,United States,2018,114384,Technology,EDP Services
RBA,Ritchie Bros. Auctioneers Incorporated Common Stock,$61.15,-0.33,-0.537%,6749214534.00,Canada,,420036,Miscellaneous,Business Services
RBAC,RedBall Acquisition Corp. Class A Ordinary Shares,$9.75,0.00,0.00%,700781250.00,United States,2020,57936,Finance,Business Services
RBC,Regal Beloit Corporation Common Stock,$153.05,-0.73,-0.475%,6228544533.00,United States,,25753,Consumer Durables,Metal Fabrications
RBLX,Roblox Corporation Class A Common Stock,$84.05,1.40,1.694%,47894334465.00,,2021,2355513,Technology,EDP Services
RC,Ready Capital Corproation Common Stock,$15.03,0.12,0.805%,1070609250.00,United States,2013,89800,Consumer Services,Real Estate Investment Trusts
RC^C,Ready Capital Corporation 6.25% Series C Cumulative Convertible Preferred Stock,$25.6937,0.0437,0.17%,,United States,,500,,
RC^E,Ready Capital Corporation 6.50% Series E Cumulative Redeemable Preferred Stock,$25.35,0.00,0.00%,,United States,,3562,,
RCA,Ready Capital Corporation 7.00% Convertible Senior Notes due 2023,$26.58,0.13,0.491%,0.00,United States,2017,324,Consumer Services,Real Estate Investment Trusts
RCB,Ready Capital Corporation 6.20% Senior Notes due 2026,$26.35,0.01,0.038%,0.00,United States,2019,1283,,
RCC,Ready Capital Corporation 5.75% Senior Notes due 2026,$25.95,0.02,0.077%,,United States,2021,5007,Finance,Finance Companies
RCI,Rogers Communication Inc. Common Stock,$50.93,0.15,0.295%,25715846446.00,Canada,,86130,Consumer Services,Telecom
RCL,D/B/A Royal Caribbean Cruises Ltd. Common Stock,$79.88,-0.46,-0.573%,20344973335.00,United States,1993,1194133,Transportation,Transportation Services
RCS,PIMCO Strategic Income Fund Inc.,$7.9091,-0.0609,-0.764%,350617331.00,United States,1994,45958,Finance,Investment Managers
RCUS,Arcus Biosciences Inc. Common Stock,$27.715,-0.065,-0.234%,1978685735.00,,2018,51595,Health Care,Major Pharmaceuticals
RDN,Radian Group Inc. Common Stock,$24.215,-0.045,-0.185%,4493274693.00,United States,,358062,Finance,Property-Casualty Insurers
RDS/B,Royal Dutch Shell PLC,$39.725,-0.635,-1.573%,,Netherlands,,1721830,,
RDY,Dr. Reddy's Laboratories Ltd Common Stock,$62.53,-0.67,-1.06%,10370473189.00,India,,17279,Health Care,Major Pharmaceuticals
RE,Everest Re Group Ltd. Common Stock,$273.91,2.49,0.917%,10921560565.00,Bermuda,,117961,Finance,Property-Casualty Insurers
RELX,RELX PLC PLC American Depositary Shares (Each representing One Ordinary Share),$30.185,0.025,0.083%,58371453474.00,United Kingdom,2015,141619,Consumer Services,Publishing
RENN,Renren Inc. American Depositary Shares each representing fifteen Class A ordinary shares,$10.07,-0.16,-1.564%,241874915.00,China,2011,5895,Technology,EDP Services
RERE,AiHuiShou International Co. Ltd. American Depositary Shares (every three of which representing two Class A ordinary shares),$13.10,-0.13,-0.983%,2916516352.00,,2021,112977,,
RES,RPC Inc. Common Stock,$3.88,-0.07,-1.772%,837014692.00,United States,,117691,Energy,Oilfield Services/Equipment
REV,Revlon Inc. New Common Stock,$11.84,0.24,2.069%,635248643.00,United States,1996,18058,Consumer Non-Durables,Package Goods/Cosmetics
REVG,REV Group Inc. Common Stock,$15.8625,0.0225,0.142%,1026968325.00,United States,2017,56468,Capital Goods,Auto Manufacturing
REX,REX American Resources Corporation,$81.98,0.00,0.00%,491224160.00,United States,,683,Basic Industries,Automotive Aftermarket
REXR,Rexford Industrial Realty Inc. Common Stock,$61.44,0.29,0.474%,8462762926.00,United States,2013,88263,Consumer Services,Real Estate Investment Trusts
REXR^A,Rexford Industrial Realty Inc. 5.875% Series A Cumulative Redeemable Preferred Stock,$25.16,-0.005,-0.02%,,United States,,2076,,
REXR^B,Rexford Industrial Realty Inc. 5.875% Series B Cumulative Redeemable Preferred Stock,$26.285,0.0221,0.084%,,United States,,400,,
REXR^C,Rexford Industrial Realty Inc. 5.625% Series C Cumulative Redeemable Preferred Stock par value $0.01 per share,$27.59,-0.0034,-0.012%,,United States,,584,,
REZI,Resideo Technologies Inc. Common Stock ,$31.215,-0.255,-0.81%,4500670503.00,,2018,206589,Miscellaneous,Diversified Manufacture
RF,Regions Financial Corporation Common Stock,$20.522,-0.268,-1.289%,19589055658.00,United States,,2328587,Finance,Major Banks
RF^B,Regions Financial Corporation Depositary Shares Representing 1/40th Perpetual Preferred Series B,$28.815,0.036,0.125%,,United States,,8396,,
RF^C,Regions Financial Corporation Depositary Shares each Representing a 1/40th Interest in a  Share of 5.700% Fixed-to-Floating Rate Non-Cumulative  Perpetual Preferred Stock Series C,$28.95,0.01,0.035%,,United States,,16536,,
RF^E,Regions Financial Corporation Depositary Shares Each Representing a 1/40th Interest in a Share of 4.45% Non-Cumulative Perpetual Preferred Stock Series E,$26.1029,0.1729,0.667%,,United States,,14746,,
RFI,Cohen & Steers Total Return Realty Fund Inc. Common Stock,$16.27,-0.01,-0.061%,427097246.00,United States,1993,17195,Finance,Investment Managers
RFL,Rafael Holdings Inc. Class B Common Stock,$49.73,0.76,1.552%,880941140.00,United States,2018,30493,Health Care,Major Pharmaceuticals
RFM,RiverNorth Flexible Municipal Income Fund Inc. Common Stock,$24.4544,0.0044,0.018%,149531295.00,,2020,4472,Finance,Trusts Except Educational Religious and Charitable
RFMZ,RiverNorth Flexible Municipal Income Fund II Inc. Common Stock,$21.45,0.05,0.234%,0.00,,2021,22422,Finance,Trusts Except Educational Religious and Charitable
RFP,Resolute Forest Products Inc. Common Stock,$11.57,-0.22,-1.866%,915282614.00,Canada,,131359,Basic Industries,Paper
RGA,Reinsurance Group of America Incorporated Common Stock,$119.90,1.03,0.866%,8152832746.00,United States,,113090,Finance,Life Insurance
RGR,Sturm Ruger & Company Inc. Common Stock,$80.96,-1.95,-2.352%,1424620736.00,United States,,37611,Consumer Non-Durables,Ordnance And Accessories
RGS,Regis Corporation Common Stock,$7.89,0.12,1.544%,282381680.00,United States,1991,37893,Consumer Services,Other Consumer Services
RGT,Royce Global Value Trust Inc. Common Stock,$15.86,0.10,0.635%,88828545.00,,2013,15432,Finance,Trusts Except Educational Religious and Charitable
RH,RH Common Stock,$719.844,-18.676,-2.529%,15138588542.00,United States,2012,210791,Consumer Services,Other Specialty Stores
RHI,Robert Half International Inc. Common Stock,$103.79,1.22,1.189%,11621370555.00,United States,,417165,Technology,Professional Services
RHP,Ryman Hospitality Properties Inc. (REIT),$79.24,-0.89,-1.111%,4363385624.00,United States,,295278,Consumer Services,Real Estate Investment Trusts
RICE,Rice Acquisition Corp. Class A Common Stock,$16.75,0.25,1.515%,496785738.00,United States,2020,9883,Finance,Finance: Consumer Services
RIG,Transocean Ltd (Switzerland) Common Stock,$3.435,-0.055,-1.576%,2236665711.00,Switzerland,,4154459,Energy,Oil & Gas Production
RIO,Rio Tinto Plc Common Stock,$79.83,0.67,0.846%,129251709542.00,Australia,2002,1780316,Basic Industries,Steel/Iron Ore
RIV,RiverNorth Opportunities Fund Inc. Common Stock,$18.68,0.08,0.43%,221065228.00,,2015,45833,Finance,Finance Companies
RJF,Raymond James Financial Inc. Common Stock,$138.82,-0.34,-0.244%,19045010237.00,United States,,103753,Finance,Investment Bankers/Brokers/Service
RKLY,Rockley Photonics Holdings Limited Ordinary Shares,$11.22,-4.11,-26.81%,0.00,,,454602,,
RKT,Rocket Companies Inc. Class A Common Stock,$19.31,1.84,10.532%,2635312399.00,United States,2020,14947250,Finance,Finance: Consumer Services
RKTA,Rocket Internet Growth Opportunities Corp. Class A Ordinary Shares,$9.6983,-0.0117,-0.12%,323680763.00,,2021,647,,
RL,Ralph Lauren Corporation Common Stock,$124.06,-0.15,-0.121%,9119570209.00,United States,1997,238417,Consumer Non-Durables,Department/Specialty Retail Stores
RLGY,Realogy Holdings Corp. Common Stock,$17.425,-0.045,-0.258%,2031479702.00,United States,2012,362266,Finance,Real Estate
RLI,RLI Corp. Common Stock (DE),$108.55,-0.12,-0.11%,4909276113.00,United States,,18761,Finance,Property-Casualty Insurers
RLJ,RLJ Lodging Trust Common Shares of Beneficial Interest $0.01 par value,$14.52,-0.02,-0.138%,2419301709.00,United States,2011,237836,Consumer Services,Real Estate Investment Trusts
RLJ^A,RLJ Lodging Trust $1.95 Series A Cumulative Convertible  Preferred Shares,$28.56,-0.04,-0.14%,,United States,,3309,,
RLX,RLX Technology Inc. American Depositary Shares each representing the right to receive one (1) Class A ordinary share,$5.00,0.08,1.626%,7853952850.00,,2021,4308311,Consumer Non-Durables,Farming/Seeds/Milling
RM,Regional Management Corp. Common Stock,$56.75,0.06,0.106%,584149712.00,United States,2012,12281,Finance,Finance: Consumer Services
RMAX,RE/MAX Holdings Inc. Class A Common Stock,$34.60,-0.46,-1.312%,653629257.00,,2013,27057,Finance,Real Estate
RMD,ResMed Inc. Common Stock,$273.62,-1.58,-0.574%,39816589192.00,United States,,112983,Health Care,Medical/Dental Instruments
RMI,RiverNorth Opportunistic Municipal Income Fund Inc. Common Stock,$23.71,-0.08,-0.336%,151110184.00,,2018,2888,Finance,Finance/Investors Services
RMM,RiverNorth Managed Duration Municipal Income Fund Inc. Common Stock,$21.44,-0.02,-0.093%,423215244.00,,2019,34777,Finance,Trusts Except Educational Religious and Charitable
RMO,Romeo Power Inc. Class A Common Stock,$6.6689,-0.2311,-3.349%,874942007.00,,2019,6585253,Capital Goods,Automotive Aftermarket
RMPL^,RiverNorth Specialty Finance Corporation 5.875% ,$25.3696,-0.0704,-0.277%,,,,643,,
RMT,Royce Micro-Cap Trust Inc. Common Stock,$11.94,-0.03,-0.251%,522551569.00,United States,,41229,Finance,Investment Managers
RNG,RingCentral Inc. Class A Common Stock,$253.63,1.53,0.607%,23209683583.00,,2013,216090,Technology,EDP Services
RNGR,Ranger Energy Services Inc. Class A Common Stock,$7.557,-0.443,-5.538%,135245468.00,United States,2017,1000,Energy,Oilfield Services/Equipment
RNP,Cohen & Steers REIT and Preferred and Income Fund Inc. Common Shares,$27.19,-0.02,-0.074%,1293759828.00,United States,2003,33759,Finance,Investment Managers
RNR,RenaissanceRe Holdings Ltd. Common Stock,$161.31,1.44,0.901%,7598570300.00,Bermuda,,112787,Finance,Property-Casualty Insurers
RNR^F,RenaissanceRe Holdings Ltd. Depositary Shares each Representing a 1/1000th Interest in a 5.750% Series F Preference Share,$27.14,0.09,0.333%,,Bermuda,,5061,,
RNR^G,RenaissanceRe Holdings Ltd. Depositary Shares each representing a 1/1000th interest in a share of 4.20% Series G Preference Shares,$25.60,0.00,0.00%,,Bermuda,,19330,,
ROG,Rogers Corporation Common Stock,$200.23,0.13,0.065%,3750136103.00,United States,,25758,Capital Goods,Industrial Machinery/Components
ROK,Rockwell Automation Inc. Common Stock,$316.67,-0.52,-0.164%,36741865386.00,United States,,96068,Capital Goods,Industrial Machinery/Components
ROL,Rollins Inc. Common Stock,$37.00,-0.19,-0.511%,18206933730.00,United States,,246738,Technology,Industrial Specialties
RONI,Rice Acquisition Corp. II Class A Ordinary Shares,$9.7607,0.0107,0.11%,336768552.00,,2021,904,,
ROP,Roper Technologies Inc. Common Stock,$482.80,3.30,0.688%,50898631883.00,United States,1992,106674,Capital Goods,Industrial Machinery/Components
ROSS,Ross Acquisition Corp II Class A Ordinary Shares,$9.70,-0.05,-0.513%,418312500.00,,2021,52046,,
ROT,Rotor Acquisition Corp. Class A Common Stock,$9.95,-0.01,-0.10%,343275000.00,,2021,753039,Finance,Finance: Consumer Services
RPAI,Retail Properties of America Inc. Class A Common Stock,$12.60,0.04,0.318%,2706453149.00,United States,2012,261035,Consumer Services,Real Estate Investment Trusts
RPM,RPM International Inc. Common Stock,$87.019,0.259,0.299%,11292807100.00,United States,,119135,Basic Industries,Paints/Coatings
RPT,RPT Realty Common Stock,$12.90,0.10,0.781%,1047136886.00,United States,,55392,Consumer Services,Real Estate Investment Trusts
RPT^D,RPT Realty 7.25% ,$56.67,-0.71,-1.237%,,United States,,3018,,
RQI,Cohen & Steers Quality Income Realty Fund Inc Common Shares,$16.56,0.15,0.914%,2223067872.00,United States,2002,225209,Finance,Trusts Except Educational Religious and Charitable
RRC,Range Resources Corporation Common Stock,$14.175,-0.345,-2.376%,3540543771.00,United States,,1015422,Energy,Oil & Gas Production
RRD,R.R. Donnelley & Sons Company Common Stock,$5.96,-0.15,-2.455%,433888000.00,United States,,83824,Consumer Services,Recreational Products/Toys
RS,Reliance Steel & Aluminum Co. Common Stock (DE),$157.015,-1.115,-0.705%,9967814020.00,United States,1994,55736,Basic Industries,Steel/Iron Ore
RSF,RiverNorth Specialty Finance Corporation,$19.72,0.00,0.00%,89851478.00,,2019,19197,Finance,Investment Managers
RSG,Republic Services Inc. Common Stock,$120.16,0.07,0.058%,38254720857.00,United States,1998,179576,Public Utilities,Environmental Services
RSI,Rush Street Interactive Inc. Class A Common Stock,$14.09,0.05,0.356%,3088210820.00,,2020,1283633,Consumer Services,Services-Misc. Amusement & Recreation
RSKD,Riskified Ltd. Class A Ordinary Shares,$27.58,-0.44,-1.57%,4347311235.00,,2021,139149,,
RTX,Raytheon Technologies Corporation Common Stock,$87.47,-0.51,-0.58%,131894096620.00,United States,,1235217,Capital Goods,Military/Government/Technical
RVI,Retail Value Inc. Common Stock ,$25.36,0.26,1.036%,535530924.00,United States,2018,16392,Consumer Services,Real Estate Investment Trusts
RVLV,Revolve Group Inc. Class A Common Stock,$61.70,-3.91,-5.959%,4489543859.00,,2019,509498,Consumer Services,Catalog/Specialty Distribution
RVT,Royce Value Trust Inc. Common Stock,$18.77,-0.09,-0.477%,1914027523.00,United States,1986,97841,Finance,Trusts Except Educational Religious and Charitable
RWT,Redwood Trust Inc. Common Stock,$12.46,0.20,1.631%,1408670558.00,United States,1995,444461,Consumer Services,Real Estate Investment Trusts
RXN,Rexnord Corporation Common Stock,$60.48,-0.19,-0.313%,7324451991.00,United States,2012,141617,Capital Goods,Industrial Machinery/Components
RY,Royal Bank Of Canada Common Stock,$104.64,-0.07,-0.067%,149122086564.00,Canada,,178105,Finance,Banks
RY^T,Royal Bank Of Canada 6.750% Fixed Rate/Floating Rate Noncumulative First Preferred Shares Series C-2,$28.89,-0.05,-0.173%,,Canada,,175,,
RYAM,Rayonier Advanced Materials Inc. Common Stock,$7.00,-0.09,-1.269%,446161471.00,United States,2014,101275,Basic Industries,Industrial Specialties
RYAN,Ryan Specialty Group Holdings Inc. Class A Common Stock,$30.20,0.27,0.902%,7823792415.00,,2021,115405,,
RYB,RYB Education Inc. American depositary shares each representing one Class A ordinary share,$2.9799,-0.1501,-4.796%,82204552.00,,2017,12206,Miscellaneous,Other Consumer Services
RYI,Ryerson Holding Corporation Common Stock,$23.0201,-0.1299,-0.561%,885689001.00,United States,2014,59857,Basic Industries,Metal Fabrications
RYN,Rayonier Inc. REIT Common Stock,$36.77,-0.16,-0.433%,5196520324.00,United States,,101202,Consumer Services,Real Estate Investment Trusts
RZA,Reinsurance Group of America Incorporated 6.20% Fixed-to-Floating Rate Subordinated Debentures due 2042,$27.11,0.02,0.074%,0.00,United States,,7362,Finance,Life Insurance
RZB,Reinsurance Group of America Incorporated 5.75% Fixed-To-Floating Rate Subordinated Debentures due 2056,$28.94,0.07,0.242%,0.00,United States,2016,8552,Finance,Life Insurance
S,SentinelOne Inc. Class A Common Stock,$50.00,0.32,0.644%,12818563950.00,,2021,357920,,
SA,Seabridge Gold Inc. Ordinary Shares (Canada),$17.27,0.40,2.371%,1302836158.00,Canada,,78787,Basic Industries,Precious Metals
SAF,Saratoga Investment Corp 6.25% Notes due 2023,$25.11,-0.0621,-0.247%,0.00,United States,2018,600,Finance,Finance Companies
SAFE,Safehold Inc. Common Stock,$89.77,-1.17,-1.287%,4787365695.00,United States,2017,24321,Consumer Services,Real Estate
SAH,Sonic Automotive Inc. Common Stock,$51.76,-0.42,-0.805%,2159217468.00,United States,1997,36083,Consumer Services,Other Specialty Stores
SAIC,SCIENCE APPLICATIONS INTERNATIONAL CORPORATION Common Stock,$83.22,0.38,0.459%,4823363625.00,,,40791,Technology,EDP Services
SAIL,SailPoint Technologies Holdings Inc. Common Stock,$44.57,-0.97,-2.13%,4142426366.00,United States,2017,397036,Technology,Computer Software: Prepackaged Software
SAK,Saratoga Investment Corp 7.25% Notes due 2025,$26.3699,-0.1301,-0.491%,0.00,United States,2020,390,Finance,Finance Companies
SAM,Boston Beer Company Inc. (The) Common Stock,$639.47,-0.53,-0.083%,7853839449.00,United States,,116979,Consumer Non-Durables,Beverages (Production/Distribution)
SAN,Banco Santander S.A. Sponsored ADR (Spain),$3.877,-0.013,-0.334%,67120666093.00,Spain,,1327545,Finance,Commercial Banks
SAND          ,Sandstorm Gold Ltd. Ordinary Shares (Canada),$6.93,0.14,2.062%,1350591976.00,Canada,,627067,Basic Industries,Precious Metals
SAP,SAP  SE ADS,$147.90,0.15,0.102%,174459784386.00,Germany,,116484,Technology,EDP Services
SAR,Saratoga Investment Corp New,$27.13,0.15,0.556%,303407568.00,United States,,12413,Finance,Finance Companies
SAVE,Spirit Airlines Inc. Common Stock,$25.0514,-0.4186,-1.644%,2715618105.00,United States,,1822919,Transportation,Air Freight/Delivery Services
SB,Safe Bulkers Inc Common Stock ($0.001 par value),$3.485,0.055,1.603%,416416823.00,Monaco,2008,284023,Transportation,Marine Transportation
SB^C,Safe Bulkers Inc Cumulative Redeemable Perpetual Preferred Series C (Marshall Islands),$25.2399,0.0399,0.158%,,Monaco,,1092,,
SB^D,Safe Bulkers Inc Perpetual Preferred Series D (Marshall Islands),$25.195,-0.0051,-0.02%,,Monaco,,729,,
SBBA,Scorpio Tankers Inc. 7.00% Senior Notes due 2025,$24.93,0.01,0.04%,0.00,Monaco,2020,7215,Transportation,Marine Transportation
SBH,Sally Beauty Holdings Inc. (Name to be changed from Sally Holdings Inc.) Common Stock,$19.31,-0.17,-0.873%,2182675340.00,United States,,115712,Miscellaneous,Diversified Commercial Services
SBI,Western Asset Intermediate Muni Fund Inc Common Stock,$9.83,0.04,0.409%,138429156.00,United States,1992,690,Finance,Finance/Investors Services
SBII,Sandbridge X2 Corp. Class A Common Stock,$9.65,0.00,0.00%,287301016.00,,2021,7707,Finance,Business Services
SBOW,SilverBow Resorces Inc. Common Stock,$17.5899,-0.2301,-1.291%,214556956.00,,,59086,Energy,Oil & Gas Production
SBR,Sabine Royalty Trust Common Stock,$39.20,-0.69,-1.73%,571510324.00,United States,,26719,Energy,Oil & Gas Production
SBS,Companhia de saneamento Basico Do Estado De Sao Paulo - Sabesp American Depositary Shares (Each repstg 250 Common Shares),$6.425,-0.155,-2.356%,4391550908.00,Brazil,2002,713838,Public Utilities,Water Supply
SBSW,D/B/A Sibanye-Stillwater Limited ADS,$16.58,-0.02,-0.12%,12238465737.00,,,706040,Basic Industries,Precious Metals
SC,Santander Consumer USA Holdings Inc. Common Stock,$42.01,-0.28,-0.662%,12858466213.00,,2014,161396,Finance,Finance: Consumer Services
SCCO,Southern Copper Corporation Common Stock,$67.015,1.005,1.522%,51808041242.00,United States,,427398,Basic Industries,Precious Metals
SCD,LMP Capital and Income Fund Inc. Common Stock,$14.51,0.03,0.207%,259952207.00,United States,2004,13135,Finance,Trusts Except Educational Religious and Charitable
SCE^G,SCE Trust II Trust Preferred Securities,$25.03,-0.05,-0.199%,,United States,,12837,,
SCE^H,SCE Trust III Fixed/Floating Rate Trust Preference Securities,$25.56,-0.06,-0.234%,,United States,,2813,,
SCE^J,Southern California Edison Company 5.375% Fixed-to-Floating Rate Trust Preference Securities,$25.14,-0.01,-0.04%,,United States,,10419,,
SCE^K,Southern California Edison Company 5.45% Fixed-to-Floating Rate Trust Preference Securities,$25.53,-0.08,-0.312%,,United States,,5927,,
SCE^L,SCE TRUST VI,$24.8499,-0.0401,-0.161%,,United States,,41263,,
SCHW,Charles Schwab Corporation (The) Common Stock,$73.90,-1.52,-2.015%,139523390366.00,United States,,1318406,Finance,Investment Bankers/Brokers/Service
SCHW^D,The Charles Schwab Corporation Depositary Shares each representing 1/40th interest in a share of 5.95% Non-Cumulative Perpetual Preferred Stock Series D,$25.76,0.02,0.078%,,United States,,22832,,
SCHW^J,The Charles Schwab Corporation Depositary Shares Each Representing a 1/40th Interest in a Share of 4.450% Non-Cumulative Perpetual Preferred Stock Series J,$26.80,0.11,0.412%,,United States,,16443,,
SCI,Service Corporation International Common Stock,$65.23,0.10,0.154%,10931145946.00,United States,,276353,Miscellaneous,Other Consumer Services
SCL,Stepan Company Common Stock,$113.42,-0.73,-0.64%,2548077955.00,United States,,13812,Consumer Non-Durables,Package Goods/Cosmetics
SCM,Stellus Capital Investment Corporation Common Stock,$13.4817,0.1917,1.442%,262704447.00,United States,2012,63618,Finance,Finance/Investors Services
SCS,Steelcase Inc. Common Stock,$13.96,-0.01,-0.072%,1614892130.00,United States,1998,62341,Consumer Durables,Office Equipment/Supplies/Services
SCU,Sculptor Capital Management Inc. Class A Common Stock,$28.21,-0.15,-0.529%,1639123431.00,United States,,114362,Finance,Investment Managers
SCVX,SCVX Corp. Class A Ordinary Shares,$9.91,0.01,0.101%,284912500.00,,2020,2090,Finance,Business Services
SCX,L.S. Starrett Company (The) Common Stock,$7.38,-0.04,-0.539%,52424229.00,United States,,4458,Consumer Durables,Home Furnishings
SD,SandRidge Energy Inc. Common Stock,$8.525,0.025,0.294%,311221382.00,,2016,438808,Energy,Oil & Gas Production
SDHY,PGIM Short Duration High Yield Opportunities Fund Common Shares,$19.229,-0.001,-0.005%,474438194.00,,2020,35442,Finance,Finance/Investors Services
SE,Sea Limited American Depositary Shares each representing one Class A Ordinary Share,$307.20,0.96,0.313%,161105971814.00,United States,2017,1354491,Technology,Computer Software: Prepackaged Software
SEAH,Sports Entertainment Acquisition Corp. Class A Common Stock,$9.965,-0.005,-0.05%,560531250.00,United States,2020,115259,Finance,Finance: Consumer Services
SEAS,SeaWorld Entertainment Inc. Common Stock,$53.13,1.68,3.265%,4206775010.00,United States,2013,295036,Consumer Services,Movies/Entertainment
SEE,Sealed Air Corporation Common Stock,$60.66,0.34,0.564%,9092498765.00,United States,,219046,Basic Industries,Containers/Packaging
SEM,Select Medical Holdings Corporation Common Stock,$35.21,-0.39,-1.096%,4738425854.00,United States,2009,225718,Health Care,Hospital/Nursing Management
SEMR,SEMrush Holdings Inc. Class A Common Stock,$21.6119,0.9819,4.76%,2928343508.00,,2021,329987,Technology,EDP Services
SF,Stifel Financial Corporation Common Stock,$68.83,-0.54,-0.778%,7212546201.00,United States,,71876,Finance,Investment Bankers/Brokers/Service
SF^A,Stifel Financial Corporation Depositary Shares each representing a 1/1000th interest in a share of 6.25% Non-Cumulative Preferred Stock Series A,$25.28,0.02,0.079%,,United States,,3261,,
SF^B,Stifel Financial Corporation Depositary Shares Each Representing 1/1000th  Interest in a Share of 6.25% Non-Cumulative  Preferred Stock Series B,$27.64,0.06,0.218%,,United States,,4347,,
SF^C,Stifel Financial Corporation Depositary Shares Each Representing 1/1000th Interest in a Share of 6.125% Non Cumulative Preferred Stock Series C,$27.80,0.17,0.615%,,United States,,5862,,
SF^D,Stifel Financial Corporation Depositary Shares Each Representing 1/1000th Interest in a Share of 4.50% Non-Cumulative Preferred Stock Series D,$25.73,0.16,0.626%,,United States,,12058,,
SFB,Stifel Financial Corporation 5.20% Senior Notes due 2047,$26.37,0.08,0.304%,0.00,United States,2017,3315,Finance,Investment Bankers/Brokers/Service
SFBS,ServisFirst Bancshares Inc. Common Stock,$72.96,-0.71,-0.964%,3954519844.00,United States,,28034,Finance,Major Banks
SFE,Safeguard Scientifics Inc. New Common Stock,$7.94,-0.25,-3.053%,166403122.00,United States,,25646,Finance,Finance/Investors Services
SFL,SFL Corporation Ltd,$7.205,0.045,0.628%,838368274.00,Bermuda,,380034,Transportation,Marine Transportation
SFTW,Osprey Technology Acquisition Corp. Class A Common Stock,$10.005,0.005,0.05%,395510156.00,,2019,59211,Finance,Finance: Consumer Services
SFUN,Fang Holdings Limited American Depositary Shares (Each representing Four Class A Ordinary Shares HK$1.00 par value),$9.07,-0.68,-6.974%,81677318.00,China,2010,219,Technology,EDP Services
SGFY,Signify Health Inc. Class A Common Stock,$26.75,1.51,5.983%,4494083861.00,,2021,1235107,Technology,Retail: Computer Software & Peripheral Equipment
SGU,Star Group L.P. Common Stock,$10.6101,-0.0299,-0.281%,420221711.00,United States,,17719,Public Utilities,Oil Refining/Marketing
SHAK,Shake Shack Inc. Class A Common Stock,$89.87,-1.54,-1.685%,3779704200.00,United States,2015,129494,Consumer Services,Restaurants
SHG,Shinhan Financial Group Co Ltd American Depositary Shares,$33.3901,-0.6699,-1.967%,17249098741.00,South Korea,,23064,Finance,Major Banks
SHI,SINOPEC Shangai Petrochemical Company Ltd. Common Stock,$21.08,-0.20,-0.94%,2281659886.00,China,,8328,Basic Industries,Major Chemicals
SHLX,Shell Midstream Partners L.P. Common Units representing Limited Partner Interests,$12.58,0.06,0.479%,4947582375.00,United States,2014,543655,Energy,Oilfield Services/Equipment
SHO,Sunstone Hotel Investors Inc. Sunstone Hotel Investors Inc. Common Shares,$11.185,-0.025,-0.223%,2449992119.00,United States,2004,450711,Consumer Services,Real Estate Investment Trusts
SHO^H,Sunstone Hotel Investors Inc. 6.125% Series H Cumulative Redeemable Preferred Stock,$26.70,0.00,0.00%,,United States,,283,,
SHO^I,Sunstone Hotel Investors Inc. 5.70% Series I Cumulative Redeemable Preferred Stock,$25.18,0.11,0.439%,,United States,,11927,,
SHOP,Shopify Inc. Class A Subordinate Voting Shares,$1496.86,-6.34,-0.422%,186791247910.00,Canada,2015,429564,Consumer Services,Other Consumer Services
SHW,Sherwin-Williams Company (The) Common Stock,$305.2359,1.5259,0.502%,80369360603.00,United States,,479251,Basic Industries,Paints/Coatings
SI,Silvergate Capital Corporation Class A Common Stock,$113.60,-0.30,-0.263%,3012742546.00,United States,2019,580734,Finance,Major Banks
